{
  "$schema": "https://json-schema.org/draft/2020-12/schema",
  "$id": "https://vivodepot.de/schemas/rechtsraum-modul-schema.json",
  "title": "Vivodepot Rechtsraum-Modul",
  "description": "Der Nutzlast-Vertrag eines Rechtsraum-Moduls: rechtsraumspezifischer Inhalt (Wortlaut, Formvorschriften, Fristen-/Vorrangregeln, Zweck), der neben dem eingebauten deutschen Katalog angedockt wird. Maßstab ist der Kern: der Rechtsraum-Prüfer im EINLASS_REGISTER von vivodepot.html (inline, mit _rechtsraumModulUebersetzen); die Probe tests/mit-modul/modul-schema-rechtsraum.test.js hält Schema und Kern im Gleichlauf. Ein Modul reist als Daten im Depot (data.rechtsraumModule[]), nicht als Quelltext. Ein Modul mit höherer moduleVersion ersetzt den gespeicherten Stand desselben Rechtsraum-Codes. Nur der Kern prüft, ob ein Typ-Schlüssel dem eingebauten Katalog bekannt ist; ein unbekannter Typ muss im tpl_-Namensraum liegen, sonst verwirft der Kern ihn, und ohne verbleibenden Typ lehnt er das Modul ab. Das frühere Pflichtfeld schemaVersion ist entfallen: der Kern hat es nie gelesen und verwarf es als unbekannt (s. docs/JURISDICTIONS.md).",
  "type": "object",
  "additionalProperties": false,
  "required": [
    "rechtsraum",
    "moduleVersion",
    "typen"
  ],
  "if": {
    "required": [
      "typen"
    ],
    "properties": {
      "typen": {
        "not": {
          "type": "object",
          "additionalProperties": {
            "not": {
              "type": "object",
              "required": [
                "wortlaut"
              ],
              "properties": {
                "wortlaut": {
                  "type": "string",
                  "pattern": "\\S"
                }
              }
            }
          }
        }
      }
    }
  },
  "then": {
    "required": [
      "sprache"
    ],
    "properties": {
      "sprache": {
        "type": "string",
        "pattern": "^[a-z]{2,3}(-[A-Za-z0-9]{2,8})*$"
      }
    }
  },
  "properties": {
    "modulTyp": {
      "const": "rechtsraum"
    },
    "rechtsraum": {
      "description": "Der Rechtsraum-Code, den dieses Modul beliefert (z. B. 'FR', 'AT'). Der Kern normalisiert den Code (Leerraum am Rand fällt weg, Großschreibung); 'DE' ist auf dem allgemeinen Einlass-Weg in jeder Schreibung reserviert; nur der gesonderte, TA-signaturgeprüfte Gerüst-Ladeweg darf ein Modul mit 'DE' annehmen — ihn beschreibt dieses Schema nicht.",
      "type": "string",
      "pattern": "\\S",
      "not": {
        "pattern": "^\\s*[dD][eE]\\s*$"
      }
    },
    "moduleVersion": {
      "description": "Aktualisieren-Zaehler (Entscheidung 8, Abweichung 1): monoton steigend. Ein erneut geladenes Modul mit hoeherer moduleVersion ERSETZT den fuer denselben rechtsraum-Code gespeicherten Stand; gleiche oder niedrigere Version aendert nichts (kein Rueckschritt).",
      "type": "integer",
      "minimum": 1
    },
    "name": {
      "description": "U2-ADR-495: der Name des Rechtsraums je Sprache (ISO 639-1), wie die Bürgerin ihn liest („Deutschland“). Freiwillig; ohne Namen zeigt der Kern den Code. Gelesen u. a. vom Lebenslagen-Hinweis (Land je Sprache).",
      "type": "object",
      "propertyNames": {
        "pattern": "^[a-z]{2}$"
      },
      "additionalProperties": {
        "type": "string",
        "minLength": 1
      }
    },
    "rechtsformen": {
      "description": "U2-ADR-495: die Rechtsformen dieses Rechtsraums, aus denen Studio und Vorlagen die Rechtsform einer Stelle wählen. Freiwillig. `kennung` ist der Wert, der in Angaben steht; `label`/`labelEn` die Anzeige; `art` ordnet sie einer Sorte zu (z. B. `verein`, `unternehmen`, `behoerde`).",
      "type": "array",
      "items": {
        "type": "object",
        "additionalProperties": false,
        "required": [
          "kennung"
        ],
        "properties": {
          "kennung": {
            "type": "string",
            "minLength": 1
          },
          "label": {
            "type": "string",
            "minLength": 1
          },
          "labelEn": {
            "type": "string",
            "minLength": 1
          },
          "art": {
            "type": "string",
            "pattern": "^[a-z][a-z0-9-]*$"
          }
        }
      }
    },
    "typen": {
      "description": "Rechtsraumspezifischer Inhalt je Instrument-Typ. Ein Schluessel, den der eingebaute Katalog bereits kennt (z. B. 'vorsorgevollmacht'), fuegt DIESEM Rechtsraum eigenen Inhalt hinzu (kein Ueberschreiben — der Slot liegt ohnehin nach {typ, rechtsraum} getrennt). Ein NEUER Typ (den der eingebaute Katalog nicht kennt, Punkt 4 'Instrument ohne deutsches Gegenstueck') MUSS den tpl_-Namensraum tragen (Namensraum-Schutz, U2-ADR-037-Muster) — sonst koennte ein kuenftiger eingebauter Typ mit demselben Namen von einem alten Modul beschattet werden.",
      "type": "object",
      "minProperties": 1,
      "additionalProperties": {
        "type": "object",
        "additionalProperties": false,
        "required": [
          "katalogVersion"
        ],
        "properties": {
          "katalogVersion": {
            "description": "Kellerwand 1 fuer DIESEN Typ-Eintrag: die Version, GEGEN DIE er gebaut wurde. Aendert sich ein Paragraf spaeter, bekommt NUR der betroffene Eintrag eine neue Zahl.",
            "type": "integer",
            "minimum": 1
          },
          "wortlaut": {
            "description": "Amtlicher Textbaustein/Wortlaut, falls vorhanden. null (nicht Feld weglassen), wenn dieser Typ keinen eigenen Wortlaut hat (Muster wie RECHTSRAUM_KATALOG.testament.DE.wortlaut = null). `wortlaut` und `bauplan` schliessen einander nicht aus — ein Typ kann nur einen Textbaustein, nur einen Bauplan, oder beides tragen.",
            "type": [
              "string",
              "null"
            ]
          },
          "bauplan": {
            "description": "Die Anweisung, wie dieses Instrument in diesem Rechtsraum entsteht — Wortlaut, Reihenfolge und Bedingungen zusammen, fuer Instrumente mit mehrschrittigem Bauplan (z. B. Patientenverfuegung/Vollmacht, U2-ADR-507 Korpus-Zuordnung). null, wenn dieser Typ keinen mehrschrittigen Bauplan hat (nur `wortlaut`, oder keins von beiden). Jeder Schritt traegt die gemeinsame Wurzel {feld, verborgenWenn?} plus die Korpus-Erweiterung {dokEinleitung?, bezug?, hilfetext?, frage?} — dieselbe Wurzel wie die Wizard-Erweiterung {feld, verborgenWenn?, ziel?} in BUERGERMODUL_BUENDEL.wizards, aber mit den Korpus-eigenen statt den Wizard-eigenen Zusatzfeldern.",
            "type": [
              "array",
              "null"
            ],
            "items": {
              "type": "object",
              "additionalProperties": false,
              "required": [
                "feld"
              ],
              "properties": {
                "feld": {
                  "description": "Das Feld dieses Schritts (Unterobjekt, kein blosser Kennung-String — gemessen an _pvBmjSchrittZuWizardSchritt, das s.feld.id liest). Freie Form je Feldtyp (id/typ Pflicht, dazu je nach typ z. B. optionen/katalogOptionenAus/beispiel/eingabeTyp) — derselbe Freiheitsgrad wie formvorschriften/fristenVorrang oben, kein zweites, engeres Feld-Schema hier nachgebaut.",
                  "type": "object",
                  "required": [
                    "id",
                    "typ"
                  ],
                  "properties": {
                    "id": {
                      "type": "string",
                      "minLength": 1
                    },
                    "typ": {
                      "type": "string",
                      "minLength": 1
                    }
                  }
                },
                "verborgenWenn": {
                  "description": "Optionale Bedingung, unter der dieser Schritt uebersprungen wird (Negativ-Form: nennt nur die ausschliessenden Katalogwerte, s. Kern-Kommentar an PV_VERBORGEN_WENN). Freie Form, wie am Wizard-Pendant.",
                  "type": "object"
                },
                "dokEinleitung": {
                  "description": "Einleitender Text vor diesem Schritt im erzeugten Dokument (Korpus-eigen, kein Wizard-Aequivalent).",
                  "type": "string"
                },
                "bezug": {
                  "description": "Bezugssatz, der diesem Schritt im erzeugten Dokument vorangestellt wird (Korpus-eigen).",
                  "type": "string"
                },
                "hilfetext": {
                  "description": "Erlaeuternder Hilfetext zu diesem Schritt (Korpus-eigen, auch am Wizard-Pendant bekannt).",
                  "type": "string"
                },
                "frage": {
                  "description": "Die Frage, die dieser Schritt der Buergerin stellt (Korpus-eigen, auch am Wizard-Pendant bekannt).",
                  "type": "string"
                }
              }
            }
          },
          "formvorschriften": {
            "description": "Formvorschrift-Struktur (freie Form je Rechtsraum — der eingebaute Katalog nutzt z. B. {paragraf, hinweis}). null, wenn keine gesonderte Formvorschrift gilt.",
            "type": [
              "object",
              "null"
            ]
          },
          "fristenVorrang": {
            "description": "Fristen-/Vorrangregel-Struktur (freie Form — der eingebaute Katalog nutzt z. B. {auswahlform, paragraf, hinweis, monate}). Wird vom Kontrollfluss gelesen (Entscheidung 8, Abweichung 2) — anders als feldDefinitionen, die laut U2-ADR-037 reine Struktur ohne Gueltigkeitsbindung sind.",
            "type": [
              "object",
              "null"
            ]
          },
          "zweck": {
            "description": "Rechtsraumunabhaengige Zweck-Markierung (Punkt 3) fuer Cross-Jurisdiktions-Matching — dasselbe Vokabular-Prinzip wie am eingebauten Katalog, nicht zwingend dieselbe geschlossene Werteliste (ein Modul kann eigene Zweck-Werte einfuehren). null, wenn (noch) keine Zuordnung getroffen wurde.",
            "type": [
              "array",
              "null"
            ],
            "items": {
              "type": "string",
              "minLength": 1
            }
          },
          "hinweise": {
            "description": "R1: Hinweise je Sprache für diesen Dokumenttyp; überschreiben `hinweise` des Moduls (z. B. KI: Anlage zu einem Testament).",
            "type": "object",
            "propertyNames": {
              "pattern": "^[a-z]{2}$"
            },
            "additionalProperties": {
              "type": "object",
              "additionalProperties": false,
              "properties": {
                "fuss": {
                  "type": "string",
                  "minLength": 1
                },
                "vorschlag": {
                  "type": "boolean"
                }
              }
            }
          },
          "rechtsgrundlage": {
            "description": "U2-ADR-466: die Rechtsgrundlage des Instruments in diesem Rechtsraum, Paragraf und Adresse der Norm. Der IPS-Export nennt `uri` als Consent.policy. Freiwillig; ohne `uri` liest der Kern den Eintrag nicht.",
            "type": "object",
            "additionalProperties": false,
            "required": [
              "uri"
            ],
            "properties": {
              "paragraf": {
                "type": "string"
              },
              "uri": {
                "type": "string",
                "pattern": "^https://"
              }
            }
          }
        }
      }
    },
    "hinweise": {
      "description": "R1 (09.10.2026): Hinweise dieses Rechtsraums je Sprache (ISO 639-1). `fuss` ist der Rechtsraum-Satz im Dokument-Fuß (Befund DEUTSCHES-RECHT-UNSICHTBAR). `vorschlag: true` heißt: noch nicht freigegeben, der Kern zeigt den Satz nicht.",
      "type": "object",
      "propertyNames": {
        "pattern": "^[a-z]{2}$"
      },
      "additionalProperties": {
        "type": "object",
        "additionalProperties": false,
        "properties": {
          "fuss": {
            "type": "string",
            "minLength": 1
          },
          "vorschlag": {
            "type": "boolean"
          }
        }
      }
    },
    "formate": {
      "description": "R1 (09.10.2026): die rechtsraumgebundenen Ausgabeformate dieses Rechtsraums (Kennungen aus EXPORT_FORMATE mit `rechtsraumGebunden`, z. B. xoev-verwaltung, fim-json). Ein solches Format bietet der Kern nur an, wenn das Modul der Zusammenstellung es hier nennt.",
      "type": "array",
      "uniqueItems": true,
      "items": {
        "type": "string",
        "minLength": 1
      }
    },
    "sprache": {
      "description": "Sprache der Beschriftungen (BCP-47-Form). Pflicht, sobald ein Typ einen nicht-leeren wortlaut trägt.",
      "type": "string"
    },
    "appVersion": {
      "description": "Vom Einlass gesetzt.",
      "type": "string"
    },
    "eingelassenAm": {
      "description": "Vom Einlass gesetzt.",
      "type": "string"
    },
    "anbieterId": {
      "description": "Vom Einlass gesetzt.",
      "type": "string"
    },
    "ungeprueft": {
      "description": "Vom Einlass gesetzt.",
      "type": "boolean"
    },
    "anbieterIdGeprueft": {
      "description": "Vom Einlass gesetzt.",
      "type": "boolean"
    },
    "lebenslageHinweise": {
      "description": "Freiwillig (16.10.2026): sachliche Auskünfte zur Rechtslage an einer Lebenslage, je Lage-Kennung eine Liste. Der Kern liest sie nur aus Modulen, die das Produkt ab Werk mitbringt, und nur für den vorgeschlagenen Rechtsraum; ein Eintrag ohne Text in der Anzeigesprache, ohne Norm oder ohne https-Quelle fällt weg.",
      "type": "object",
      "additionalProperties": {
        "type": "array",
        "items": {
          "type": "object",
          "additionalProperties": false,
          "required": [
            "text",
            "quelle",
            "norm"
          ],
          "properties": {
            "text": {
              "type": "object",
              "additionalProperties": {
                "type": "string",
                "minLength": 1,
                "maxLength": 400
              }
            },
            "quelle": {
              "type": "string",
              "pattern": "^https://"
            },
            "norm": {
              "type": "string",
              "minLength": 1,
              "maxLength": 80
            }
          }
        }
      }
    }
  }
}
