{
  "modulTyp": "rechtsraum",
  "rechtsraum": "DE",
  "moduleVersion": 1,
  "sprache": "de",
  "anbieterId": "vivodepot",
  "name": {
    "de": "Deutschland",
    "en": "Germany"
  },
  "rechtsformen": [
    {
      "kennung": "e.V.",
      "labelEn": "Registered association (e.V.)",
      "art": "verein"
    },
    {
      "kennung": "GmbH",
      "labelEn": "GmbH (limited company)",
      "art": "unternehmen"
    },
    {
      "kennung": "AG",
      "labelEn": "AG (public limited company)",
      "art": "unternehmen"
    },
    {
      "kennung": "Anstalt öffentlichen Rechts",
      "labelEn": "Public-law institution"
    },
    {
      "kennung": "Behörde",
      "labelEn": "Public authority",
      "art": "behoerde"
    },
    {
      "kennung": "sonstige Körperschaft",
      "labelEn": "Other corporate body"
    }
  ],
  "formate": [
    "xoev-verwaltung",
    "fim-json"
  ],
  "hinweise": {
    "de": {
      "fuss": "Dokumentart nach deutschem Recht."
    },
    "en": {
      "fuss": "Document type under German law.",
      "vorschlag": true
    }
  },
  "typen": {
    "enduring-power-of-attorney": {
      "katalogVersion": 1,
      "wortlaut": null,
      "formvorschriften": null,
      "fristenVorrang": {
        "auswahlform": "alle"
      },
      "zweck": [
        "vermoegenssorge",
        "gesundheitssorge"
      ],
      "rechtsgrundlage": {
        "paragraf": "§ 1820 BGB",
        "uri": "https://www.gesetze-im-internet.de/bgb/__1820.html"
      }
    },
    "custodianship-declaration": {
      "katalogVersion": 1,
      "wortlaut": null,
      "formvorschriften": null,
      "fristenVorrang": {
        "auswahlform": "neueste"
      },
      "zweck": [
        "vermoegenssorge",
        "gesundheitssorge"
      ],
      "rechtsgrundlage": {
        "paragraf": "§ 1816 Abs. 2 Satz 4 BGB",
        "uri": "https://www.gesetze-im-internet.de/bgb/__1816.html"
      }
    },
    "living-will": {
      "katalogVersion": 1,
      "wortlaut": null,
      "formvorschriften": {
        "paragraf": "§ 1827 BGB"
      },
      "fristenVorrang": {
        "auswahlform": "neueste",
        "gueltigkeit": "lebenslang",
        "paragraf": "§ 1827 BGB"
      },
      "zweck": [
        "gesundheitssorge"
      ],
      "rechtsgrundlage": {
        "paragraf": "§ 1827 BGB",
        "uri": "https://www.gesetze-im-internet.de/bgb/__1827.html"
      }
    },
    "ki-verfuegung": {
      "katalogVersion": 1,
      "wortlaut": null,
      "formvorschriften": {
        "paragraf": "§ 2247 BGB",
        "hinweis": null
      },
      "fristenVorrang": {
        "auswahlform": "neueste"
      },
      "zweck": [
        "postmortalespersoenlichkeitsrecht"
      ],
      "hinweise": {
        "de": {
          "fuss": "Gedacht als Anlage zu einem Testament nach deutschem Recht."
        },
        "en": {
          "fuss": "Intended as an annex to a will under German law.",
          "vorschlag": true
        }
      }
    },
    "will": {
      "katalogVersion": 1,
      "wortlaut": null,
      "formvorschriften": {
        "paragraf": "§ 2247 BGB",
        "hinweis": "Eigenhändig geschrieben und unterschrieben; die Bindung einer KI-Verfügung entsteht erst über die Einbettung ins Testament."
      },
      "fristenVorrang": {
        "auswahlform": "neueste",
        "paragraf": "§ 2258 BGB",
        "hinweis": "Das jüngere Testament widerruft das frühere."
      },
      "zweck": [
        "nachlass"
      ]
    },
    "spousal-emergency-representation": {
      "katalogVersion": 1,
      "wortlaut": null,
      "formvorschriften": null,
      "fristenVorrang": {
        "monate": 6,
        "paragraf": "§ 1358 Abs. 3 Nr. 4 BGB",
        "hinweis": "Erlischt sechs Monate nach dem ärztlich festgestellten Zeitpunkt; deckt nur Gesundheitsangelegenheiten (Abs. 1)."
      },
      "zweck": null,
      "rechtsgrundlage": {
        "paragraf": "§ 1358 Abs. 3 Nr. 2 BGB",
        "uri": "https://www.gesetze-im-internet.de/bgb/__1358.html"
      }
    }
  },
  "lebenslageHinweise": {
    "lange-krankheit": [
      {
        "text": {
          "de": "Krankengeld gibt es wegen derselben Krankheit für höchstens 78 Wochen innerhalb von je drei Jahren.",
          "en": "Sickness benefit (Krankengeld) for the same illness is paid for at most 78 weeks within each three-year period."
        },
        "quelle": "https://www.gesetze-im-internet.de/sgb_5/__48.html",
        "norm": "§ 48 SGB V"
      },
      {
        "text": {
          "de": "Danach kann Arbeitslosengeld in Betracht kommen, auch wenn die Leistungsfähigkeit noch gemindert ist.",
          "en": "After that, unemployment benefit may be available even if the ability to work is still reduced."
        },
        "quelle": "https://www.gesetze-im-internet.de/sgb_3/__145.html",
        "norm": "§ 145 SGB III"
      },
      {
        "text": {
          "de": "Fordert die Krankenkasse auf, Leistungen zur Rehabilitation zu beantragen, gilt dafür eine Frist von zehn Wochen.",
          "en": "If the health insurance fund asks for an application for rehabilitation benefits, a ten-week time limit applies."
        },
        "quelle": "https://www.gesetze-im-internet.de/sgb_5/__51.html",
        "norm": "§ 51 SGB V"
      }
    ]
  }
}
